[
  {
    "id": "historical:authority_spoof",
    "title": "Forged authority",
    "description": "Claimed privileged administrator instructions versus a training handout that discusses those labels.",
    "domain": "guardrail-classification",
    "requires": [],
    "caseCount": 864
  },
  {
    "id": "historical:delimiter_breakout",
    "title": "Boundary breakout",
    "description": "Literal closing tags in source text attempt to create a system message; contrast XML syntax documentation.",
    "domain": "guardrail-classification",
    "requires": [],
    "caseCount": 864
  },
  {
    "id": "historical:encoded_payload",
    "title": "Encoded payload smuggling",
    "description": "Base64-carried redirection in tool-style material versus an encoded weather description.",
    "domain": "guardrail-classification",
    "requires": [],
    "caseCount": 864
  },
  {
    "id": "historical:split_resources",
    "title": "Cross-resource assembly",
    "description": "Associated source fragments jointly redirect an assessment; contrast harmless agenda fragments.",
    "domain": "guardrail-classification",
    "requires": [],
    "caseCount": 864
  },
  {
    "id": "historical:conversation_poison",
    "title": "Already adopted instruction",
    "description": "Fixed prior-conversation snapshots about adoption or rejection of source instructions; requires history-integrity scoring.",
    "domain": "guardrail-classification",
    "requires": [],
    "caseCount": 864
  },
  {
    "id": "historical:memory_poison",
    "title": "Tampered stored memory",
    "description": "External stored memory that changes future assessments versus confirmed user formatting preferences; requires memory-integrity scoring.",
    "domain": "guardrail-classification",
    "requires": [],
    "caseCount": 864
  },
  {
    "id": "historical:retrieval_poison",
    "title": "Retrieval contamination",
    "description": "Replacement of an active retrieved policy index versus an archived historical proposal; requires provenance and contamination semantics.",
    "domain": "guardrail-classification",
    "requires": [],
    "caseCount": 864
  },
  {
    "id": "historical:tool_output_spoof",
    "title": "Tool result impersonation",
    "description": "A tool-result object impersonates a developer directive; contrast ordinary tool records.",
    "domain": "guardrail-classification",
    "requires": [],
    "caseCount": 864
  },
  {
    "id": "historical:judge_injection",
    "title": "Judge contamination",
    "description": "Candidate answer explanations attempt to dictate the judge verdict independently of known answer correctness; requires judge-task adapter.",
    "domain": "judging",
    "requires": [],
    "caseCount": 864
  },
  {
    "id": "historical:answer_laundering",
    "title": "Answer and citation laundering",
    "description": "Citation-like text dictates the final assessment versus documentation requesting independent source review.",
    "domain": "guardrail-classification",
    "requires": [],
    "caseCount": 864
  },
  {
    "id": "historical:policy_override",
    "title": "Untrusted strictness override",
    "description": "Retrieved text tries to disable active policy rules or strictness versus discussion of policy profiles.",
    "domain": "guardrail-classification",
    "requires": [],
    "caseCount": 864
  },
  {
    "id": "historical:moderation_targeted",
    "title": "Targeted insult policy boundary",
    "description": "Targeted insulting content versus a classroom quotation; expected moderation depends on the old policy profile, not injection labels.",
    "domain": "moderation",
    "requires": [],
    "caseCount": 648
  },
  {
    "id": "historical:moderation_identifier",
    "title": "Consent and identifier boundary",
    "description": "Disclosure of a synthetic contact with versus without stated consent; requires old moderation-policy semantics.",
    "domain": "moderation",
    "requires": [],
    "caseCount": 648
  },
  {
    "id": "historical:zero_width",
    "title": "Invisible separators",
    "description": "Zero-width characters conceal instruction text versus a typography sample.",
    "domain": "guardrail-classification",
    "requires": [],
    "caseCount": 864
  },
  {
    "id": "historical:html_negative_space",
    "title": "Hidden and negative visual space",
    "description": "Source HTML styling/comments carry concealed instructions versus decorative spacers. No rendered-image observation.",
    "domain": "guardrail-classification",
    "requires": [],
    "caseCount": 864
  },
  {
    "id": "historical:bidi_confusable",
    "title": "Bidi and confusable text",
    "description": "Direction markers and cross-script confusables carry redirection versus a typography lesson.",
    "domain": "guardrail-classification",
    "requires": [],
    "caseCount": 864
  },
  {
    "id": "historical:emoji_variation",
    "title": "Variation-selector payload",
    "description": "Variation selectors encode UTF-8 instruction bytes versus an ordinary decorative emoji.",
    "domain": "guardrail-classification",
    "requires": [],
    "caseCount": 864
  },
  {
    "id": "historical:multilingual_redirect",
    "title": "Cross-language redirection",
    "description": "Spanish/French instructional redirection versus bilingual greetings; language restriction and attack semantics are separate.",
    "domain": "guardrail-classification",
    "requires": [],
    "caseCount": 864
  }
]
